make,model,parent_generation,review_description,rating_stars,review_title,review_author,helpful
AMC,Concord,1978-1983,"I purchased the Coverland Premium Car Cover for my AMC Concord, but I wasn't impressed with its performance. Despite claiming to be waterproof, water leaked through the seams. I almost returned it, but my husband liked some of its features, so he's going to try using a waterproof spray on the seams to prevent leakage. Can't comment on durability after only one month.",2,"""Not Impressed with the Cover for my AMC Concord",Sadie Barclay,1
AMC,Concord,1978-1983,"I have bought many covers for my car, but the Coverland Premium Car Cover has been the best one so far. It fits well and has proven to be waterproof. It is easy to put on and secure, and the zipper entry for the driver's door is a great feature. The customer service from Coverland was outstanding when I had an issue with the cover. They promptly sent me a new one, and I am very happy with their service. Highly recommend this cover!",5,"""Extremely Satisfied with the Coverland Premium Car Cover",John Weber,20
AMC,Concord,1978-1983,"I was initially skeptical about the Coverland Premium Car Cover, but it ended up exceeding my expectations. The fit is great, and it provides excellent water protection. I live in Florida, where we experience harsh sun and rain, and this cover has held up well. It also does a good job of reflecting heat. I am impressed with the quality and durability of this product. Definitely worth the investment!",5,"""Pleasantly Surprised with the Coverland Premium Car Cover",Marie Ritter,15
AMC,Concord,1978-1983,"I bought the Coverland Premium Car Cover as a gift for my partner, and they absolutely love it. It fits their car perfectly and provides excellent protection against the weather. They appreciate the adjustable retaining straps and the additional strap for securing it under the vehicle. The cover has been durable and has kept their car dry and protected. Highly recommended!",5,"""Perfect Gift for my Loved One",Nancy Baker,10
AMC,Concord,1978-1983,"Living in South Florida, I needed a car cover that could withstand the intense sun and occasional heavy rain. The Coverland Premium Car Cover has been the perfect solution. It fits well and has excellent waterproofing capabilities. The high-quality material has held up well under the extreme weather conditions. Highly satisfied with this cover!",5,"""Great Cover for the Harsh South Florida Climate",William Work,5
AMC,Concord,1978-1983,"The Coverland Premium Car Cover is top-notch! It fits my car perfectly, and the waterproofing is outstanding. The material is durable and easy to clean. I highly recommend this cover for its quality and performance.",5,"""Excellent Car Cover!",Jane Manzanares,2
AMC,Concord,1978-1983,"The Coverland Premium Car Cover is a good option for protecting your car. It fits well and provides decent waterproofing. While it may not be the absolute best cover on the market, it does the job effectively and is a good value for the price.",5,"""Good Car Cover",Erin Jackson,1
AMC,Rambler Cross Country,1958-1962,"I looked at several car covers for my AMC Rambler Cross Country and this one looked like the best. It fits perfectly, just make sure you use the sizing chart when ordering. However, I learned that it's not completely waterproof in heavy rain. Shortly after putting it on my car, we had a severe thunderstorm and some water did get through, probably through the seam. But I've found that no car covers are completely waterproof, so I guess it should be expected. This particular cover has adjustable retaining straps in the front and back and comes with an extra strap for the midbody to secure the cover under the vehicle. It also has grommets for an anti-theft cable or bungee cord to keep the cover firmly in place. It also comes with an antenna grommet, and you can add a large nylon drawstring storage bag. One word of caution, I followed the instructions for installing the cover which state that it's not necessary to use the antenna grommet if you have a flexible antenna. Well, that didn't work out well because when I removed the cover, which was heavy, my rubber flex antenna was bent and cracked in several places. In retrospect, my car's six years old and the rubber was weathered and hardened. But be aware that you might want to remove any detachable antennas before using this cover, as a replacement antenna cost me [Amazon]. Other than that, I'm happy with this cover, it's well made, easy to install, and stayed on my car during 70 MPH winds and heavy rain. (Helpful: 1, Rating: 2)",2,"Fits my AMC Rambler Cross Country perfectly 
Content: I looked at several car covers for my AMC Rambler Cross Country and this one looked like the best. It fits perfectly, just make sure you use the sizing chart when ordering. However, I learned that it's not completely waterproof in heavy rain. Shortly after putting it on my car, we had a severe thunderstorm and some water did get through, probably through the seam. But I've found that no car covers are completely waterproof, so I guess it should be expected. This particular cover has adjustable retaining straps in the front and back and comes with an extra strap for the midbody to secure the cover under the vehicle. It also has grommets for an anti-theft cable or bungee cord to keep the cover firmly in place. It also comes with an antenna grommet, and you can add a large nylon drawstring storage bag. One word of caution, I followed the instructions for installing the cover which state that it's not necessary to use the antenna grommet if you have a flexible antenna. Well, that didn't work out well because when I removed the cover, which was heavy, my rubber flex antenna was bent and cracked in several places. In retrospect, my car's six years old and the rubber was weathered and hardened. But be aware that you might want to remove any detachable antennas before using this cover, as a replacement antenna cost me [Amazon]. Other than that, I'm happy with this cover, it's well made, easy to install, and stayed on my car during 70 MPH winds and heavy rain.",Tim Davidson,1
AMC,Rambler Cross Country,1958-1962,"I bought the Coverland Car Cover Waterproof All Weather for my AMC Rambler Cross Country after reading reviews from other people, and I agree, it fits perfectly. We had rain and snow, and my car stayed dry under this cover. I'm satisfied with the purchase and recommend it to others. (Helpful: 20, Rating: 5)",5,"Good quality, good fit 
Content: I bought the Coverland Car Cover Waterproof All Weather for my AMC Rambler Cross Country after reading reviews from other people, and I agree, it fits perfectly. We had rain and snow, and my car stayed dry under this cover. I'm satisfied with the purchase and recommend it to others.",Elliot Buchanon,20
AMC,Rambler Cross Country,1958-1962,"I've bought many other brands of car covers in the past, all stating that they are waterproof. I can attest that this Coverland Premium cover does exactly what it states, excellent water protection. I've recently had winds over 70 mph and the fitted car cover adheres perfectly without any concerns whatsoever. In comparison to many other car tarp purchases, this brand has certainly lived up well to its rated claims. I'm truly impressed and satisfied with this car cover purchase. This purchase has proven so far to be one of my best-ever auto covers over the decades. (Helpful: 20, Rating: 5)",5,"Coverland Premium Car Cover: Legitimately a Good Investment of Protection, Comparatively 
Content: I've bought many other brands of car covers in the past, all stating that they are waterproof. I can attest that this Coverland Premium cover does exactly what it states, excellent water protection. I've recently had winds over 70 mph and the fitted car cover adheres perfectly without any concerns whatsoever. In comparison to many other car tarp purchases, this brand has certainly lived up well to its rated claims. I'm truly impressed and satisfied with this car cover purchase. This purchase has proven so far to be one of my best-ever auto covers over the decades.",John Bryan,20
AMC,Rambler Cross Country,1958-1962,"This cover is waterproof. It's also easy to dry off after rain. I've purchased many truck covers over the years, and this is the best and least expensive truck cover I have ever purchased. The only bad thing is that I would like to have mirror pockets. (Helpful: 15, Rating: 5)",5,"Great truck cover 
Content: This cover is waterproof. It's also easy to dry off after rain. I've purchased many truck covers over the years, and this is the best and least expensive truck cover I have ever purchased. The only bad thing is that I would like to have mirror pockets.",Marian Carr,15
AMC,Rambler Cross Country,1958-1962,"I'm very pleased with this car cover. It's fully waterproof and relatively easy to remove and replace. The cover adapts to the shape of the vehicle over time, making it easier to use. I wish I had bought one years ago as I do not have a home garage. (Helpful: 15, Rating: 5)",5,"Almost As Good as Garage 
Content: I'm very pleased with this car cover. It's fully waterproof and relatively easy to remove and replace. The cover adapts to the shape of the vehicle over time, making it easier to use. I wish I had bought one years ago as I do not have a home garage.",Marlena Therrien,15
AMC,Rambler Cross Country,1958-1962,"It fits great and really covers my car. It's waterproof and seems to be holding up. I believe this will last longer than the Budge covers sold in-store by Walmart. (Helpful: 15, Rating: 5)",5,"Great fit, seems very durable 
Content: It fits great and really covers my car. It's waterproof and seems to be holding up. I believe this will last longer than the Budge covers sold in-store by Walmart.",Nancy Chesney,15
AMC,Rambler Cross Country,1958-1962,"I have bought many covers for my AMC Rambler Cross Country, and this cover has been the best. It fits well, is easy to put on and secure. The only problem is that it only lasted 6 months. However, after 6 months of harsh South Florida sun, the price is excellent. Also, when I contacted the company, I found out that I had an extended warranty. I provided a few pictures showing the material deteriorating, and the company sent me a new cover. The customer service was terrific. They were fast, polite, and professional. I have already received the new cover, and I will continue to do business with them. (Helpful: 10, Rating: 5)",5,"Best cover, outstanding customer service 
Content: I have bought many covers for my AMC Rambler Cross Country, and this cover has been the best. It fits well, is easy to put on and secure. The only problem is that it only lasted 6 months. However, after 6 months of harsh South Florida sun, the price is excellent. Also, when I contacted the company, I found out that I had an extended warranty. I provided a few pictures showing the material deteriorating, and the company sent me a new cover. The customer service was terrific. They were fast, polite, and professional. I have already received the new cover, and I will continue to do business with them.",Debra Donnerberg,10
AMC,Rambler Cross Country,1958-1962,"This cover seems more like two layers than truly waterproof. It's a good value, fits my car very well, and the buckle straps keep it in place. Recommended. (Helpful: 1, Rating: 5)",5,"Thin 
Content: This cover seems more like two layers than truly waterproof. It's a good value, fits my car very well, and the buckle straps keep it in place. Recommended.",Wendy Thompson,1
AMC,Spirit,1979-1983,I bought this car cover for my AMC Spirit and was really disappointed. It was too small and didn't fit properly. The material also felt cheap and easily tore. I ended up returning it and finding a different brand.,2,Fits my AMC Spirit perfectly!,Nicholas Mason,1
AMC,Spirit,1979-1983,I recently purchased the Coverland Premium Car Cover for my AMC Spirit and I couldn't be happier. The cover fits my car perfectly and provides great protection against the elements. It's made of high-quality material that feels durable and waterproof. I highly recommend this cover for any AMC Spirit owner.,5,Great quality and fit for my AMC Spirit!,Magnolia Pearce,20
AMC,Spirit,1979-1983,"I was hesitant to buy the Coverland Premium Car Cover for my AMC Spirit at first because I've had bad experiences with other covers in the past. However, I decided to give it a try and I'm so glad I did. This cover is excellent! It fits perfectly and has kept my car dry even in heavy rain. I'm very impressed and highly recommend it.",5,"Skeptical at first, but love it now!",Manuel Silva,15
AMC,Spirit,1979-1983,I purchased the Coverland Premium Car Cover as a gift for my friend who owns an AMC Spirit and they absolutely love it. They mentioned how well it fits their car and how it provides excellent protection against the weather. They are very satisfied with this cover.,5,Bought it for a friend and they loved it!,Andrea Peterson,10
AMC,Spirit,1979-1983,"Living in Florida, I needed a car cover that could withstand the intense heat and occasional storms. The Coverland Premium Car Cover has been perfect for my AMC Spirit. It keeps my car dry during rainstorms and protects it from the harsh sun. I'm very happy with this purchase.",5,Perfect protection for my car in Florida!,Michael Bowers,5
AMC,Spirit,1979-1983,This car cover is perfect for my AMC Spirit. It fits well and provides great protection against the elements. Highly recommended!,5,Excellent car cover!,Richard Hayden,2
AMC,Spirit,1979-1983,I'm happy with the quality of this car cover. It fits my AMC Spirit well and does a good job protecting it.,5,Good quality cover!,Thomas Colon,1
AMC,Spirit,1979-1983,I was really disappointed with this car cover. It didn't fit my AMC Spirit properly and the material felt cheap. I ended up returning it and finding a better option.,2,Not impressed with this cover.,Leticia Spera,1
AMC,Rambler Ambassador,1958-1962,"Unfortunately, this car cover did not fit my 1960 Rambler Ambassador properly. It was too loose and did not provide adequate protection. I was disappointed with the quality and fit of the product.",2,Dissatisfied with the Fit for My 1960 Rambler Ambassador,Mary Zamora,1
AMC,Rambler Ambassador,1958-1962,"I purchased the Coverland Premium Car Cover for my AMC Rambler Ambassador from 1958 and I have been extremely satisfied with it. The waterproofing is excellent, and the cover has held up well in heavy rain and wind. The quality is top-notch and it fits my car perfectly. Highly recommended!",5,Impressed with the Waterproofing and Quality,Phyllis Morgan,20
AMC,Rambler Ambassador,1958-1962,"I was initially skeptical about the waterproof claims of the Coverland Premium Car Cover, but it has surpassed my expectations. Living in Texas, we experience intense heat and occasional rainstorms. This cover has kept my car dry and protected in all weather conditions. I am thrilled with my purchase!",5,"Skeptical at First, But Now a Believer",Julieta Davenport,15
AMC,Rambler Ambassador,1958-1962,"I had my doubts about the Coverland Premium Car Cover, but it has proven to be a fantastic investment. The cover is durable and has withstood strong winds and heavy rain without any issues. It fits my car perfectly and provides excellent protection. Highly recommend!",5,Pleasantly Surprised by the Durability and Performance,Delois Friel,15
AMC,Rambler Ambassador,1958-1962,"I bought the Coverland Premium Car Cover as a gift for my friend in Louisiana, and he absolutely loves it. The cover fits his car perfectly, and he has praised its durability and waterproofing. It has provided excellent protection for his car in the unpredictable Louisiana weather. Fantastic purchase!",5,Perfect Gift for My Friend in Louisiana,Fernando Watts,10
AMC,Rambler Ambassador,1958-1962,"As a Florida resident, I needed a car cover that could withstand the intense sun and occasional rainstorms. The Coverland Premium Car Cover has been a game-changer. It fits my car well, keeps it dry, and offers protection against the harsh Florida elements. Highly satisfied!",5,Great Protection for My Car in Florida,Wm Davidson,5
AMC,Rambler Ambassador,1958-1962,The Coverland Premium Car Cover was an easy and perfect fit for my AMC Rambler Ambassador. I appreciate the adjustable straps and it stays securely in place. Highly recommended!,5,Quick and Perfect Fit,Jorge Dunn,2
AMC,Rambler Ambassador,1958-1962,The Coverland Premium Car Cover has been a good investment for my AMC Rambler Ambassador. It is made of high-quality material and performs well in protecting my car. I am satisfied with my purchase. Great value for money!,5,Good Quality and Performance,Michael Dolan,1
AMC,Matador,1971-1978,"I bought the AMC Matador Car Cover for my car and unfortunately, it didn't live up to my expectations. The cover leaked through the seams, and despite trying to use a waterproof spray on the seams, the leakage persisted. I almost returned it, but my husband liked the other features, so he's going to give the waterproof spray another try. Can't comment on durability after only one month.",2,AMC Matador Car Cover - Didn't Meet Expectations,Patricia Kurian,1
AMC,Matador,1971-1978,"I have purchased many car covers for my AMC Matador over the years, and the Coverland Premium Car Cover has been the best by far. It fits well and has proved to be waterproof, easy to put on and secure. The company's customer service is also exceptional. When I contacted them about my cover only lasting a few months, they provided me with a new cover as part of their extended warranty. I will continue to do business with them.",5,Coverland Premium Car Cover - Outstanding Protection and Service,Bruce Caperton,20
AMC,Matador,1971-1978,"I am very pleased with the Coverland Premium Car Cover for my AMC Matador. It is fully waterproof and relatively easy to remove and replace. The cover adapts to the shape of the vehicle over time, making it easier to use. I wish I had bought one years ago as I do not have a home garage. Great fit and seems very durable.",5,Coverland Premium Car Cover - Almost As Good as a Garage,Greg Bard,15
AMC,Matador,1971-1978,"The Coverland Premium Car Cover fits my AMC Matador perfectly and provides excellent protection. It is waterproof and has stayed on even in heavy winds. The zipper entry for the driver's door is a great feature. I have owned many car covers, and this one is the best so far. Highly recommended.",5,"Coverland Premium Car Cover - Fits Perfectly, Protects Well",David Barber,15
AMC,Matador,1971-1978,I purchased the Coverland Premium Car Cover as a gift for my friend who owns an AMC Matador. They absolutely love it. It fits their car perfectly and provides excellent protection against the weather and natural elements. The high-quality materials and durability are impressive. They were thrilled with this purchase.,5,"Coverland Premium Car Cover - Great Fit, Great Durability",Griselda Res,10
AMC,Matador,1971-1978,"As a resident of South Florida, it is crucial to have a reliable car cover, and the AMC Matador Car Cover has exceeded my expectations. It has kept my car dry and protected against the harsh sun and occasional rain showers. I highly recommend this cover for anyone living in humid and sunny regions.",5,AMC Matador Car Cover - Perfect for Southern States,Edith Blankenship,5
AMC,Matador,1971-1978,"The Coverland Premium Car Cover may seem thin, but it provides good value for money. It fits my AMC Matador well, and the buckle straps keep it securely in place. Recommended for those looking for an affordable yet effective car cover.",5,Coverland Premium Car Cover - Thin but Value for Money,David Bradford,2
AMC,Matador,1971-1978,The Coverland Premium Car Cover is of great quality and fits my AMC Matador perfectly. It is waterproof and easy to dry off after rain. This is the best and least expensive truck cover that I have ever purchased. Highly recommended.,5,"Coverland Premium Car Cover - Great Quality, Great Fit",Ericka Snow,1
AMC,Pacer,1975-1980,"I had high hopes for the Coverland Premium Car Cover for my AMC Pacer, but it fell short of my expectations. The seams leaked during heavy rain, and I ended up returning it. Not worth the price.",2,Disappointed with the Coverland Premium Car Cover for AMC Pacer,Nora Dunn,1
AMC,Pacer,1975-1980,"I have purchased many car covers in the past and can genuinely say that the Coverland Premium Car Cover is one of the best. It provides excellent water protection, and I have confidently used it in windy conditions without any issues. I am thoroughly impressed and satisfied with this purchase.",5,Coverland Premium Car Cover is a Great Investment for Protection,Justin Hacher,20
AMC,Pacer,1975-1980,"I was skeptical about buying the Coverland Premium Car Cover, but it turned out to be a fantastic product. It fits perfectly and keeps my car dry even during heavy rainfall. The added features like the zipper entry and reflectors make it a convenient and dependable choice. Highly recommended!",5,Pleasantly Surprised by the Coverland Premium Car Cover,Joseph Helstrom,15
AMC,Pacer,1975-1980,"I bought the Coverland Premium Car Cover as a gift for my friend, and they absolutely love it. It fits their car perfectly and provides excellent waterproofing. They have been impressed with the quality and durability of the cover. A great purchase!",5,My Friend Loves the Coverland Premium Car Cover,Juanita Grant,10
AMC,Pacer,1975-1980,"Living in Florida, I needed a car cover that could withstand the harsh sun and occasional rainstorms. The Coverland Premium Car Cover has exceeded my expectations. It fits well, provides excellent protection, and has proven to be durable even in the hot, humid climate. Highly recommended for anyone in the Sunshine State!",5,Coverland Premium Car Cover is Perfect for the Florida Heat,Troy Mckoy,5
AMC,Pacer,1975-1980,This car cover fits my car perfectly and does a great job keeping it dry. Highly recommend! ,5,Fits My Car Perfectly,Sharon Brackley,2
AMC,Pacer,1975-1980,The Coverland Premium Car Cover is of good quality and easy to put on and take off. It has kept my car dry during rainstorms. Highly satisfied with my purchase.,5,Good Quality and Easy to Use,Daniel Eveland,1
AMC,Rambler Classic,1965-1966,"I was a bit skeptical about purchasing this car cover, but I am so glad I did. It fits my AMC Rambler Classic perfectly and provides excellent protection against the weather. The cover is waterproof and has kept my car dry during heavy rainstorms. The high-quality material feels durable and the tailored fit is top-notch. I highly recommend this cover for any AMC Rambler Classic owner.",5,Great Cover for my AMC Rambler Classic 1965-1966,Elizabeth Whitney,20
AMC,Rambler Classic,1965-1966,"I have owned many car covers in the past, but the Coverland Premium Car Cover is by far the best. It offers outstanding protection against water and has proven to be truly waterproof. Even during strong winds, the cover stays securely in place without any concerns. The quality of the fabric is exceptional and it fits my car perfectly. This purchase has definitely been a great investment for keeping my car protected.",5,Highly Impressed with the Coverland Premium Car Cover,Lisa Berthold,20
AMC,Rambler Classic,1965-1966,"Initially, I had doubts about the effectiveness of this car cover, but it has exceeded my expectations. The cover is waterproof and has kept my car dry even during heavy rain. The straps for windproofing are a great feature that ensures the cover stays secure. The reflective strips add a nice touch for visibility. I am very impressed with the durability and overall quality of this cover.",5,Pleasantly Surprised with the Coverland Premium Car Cover,Judith Blue,15
AMC,Rambler Classic,1965-1966,"I was skeptical about the claims of this car cover, but it has proven to be worth every penny. The cover is waterproof and has protected my car from rain, snow, and even high winds. The adjustable straps are a great addition to keep the cover in place. The material is durable and of high quality. I highly recommend this cover for anyone looking for reliable protection for their car.",5,Skeptic Turned Believer - Coverland Premium Car Cover,Charla Wingham,15
AMC,Rambler Classic,1965-1966,"I bought this car cover as a gift for my friend who owns an AMC Rambler Classic 1965-1966. They absolutely loved it! The cover fits their car perfectly and provides excellent protection against the elements. It is durable and easy to install. I'm so glad I chose this as a gift, and my friend couldn't be happier with it.",5,The Perfect Gift - Coverland Premium Car Cover,Marlene Walker,10
AMC,Rambler Classic,1965-1966,"Living in South Florida, I needed a car cover that could withstand the constant sun and occasional rainstorms. The Coverland Premium Car Cover has been a lifesaver. It keeps my car protected from the intense heat and provides excellent waterproofing during heavy downpours. I couldn't be happier with this purchase and highly recommend it to fellow Floridians.",5,Coverland Premium Car Cover: Perfect for South Florida Weather,Elmer Jones,5
AMC,Rambler Classic,1965-1966,This car cover fits my car perfectly and offers great protection. Highly recommend!,5,Fits like a Glove!,Henry Mestas,2
AMC,Rambler Classic,1965-1966,I'm happy with this car cover. It does its job well and is a good value for the price.,5,Good Quality Cover,Jamie Hall,1
