make,model,parent_generation,review_description,rating_stars,review_title,review_author,helpful
AMC,Rambler American,1958-1960,"I bought several car covers for my AMC Rambler American, and this one looked like the best option. It initially fit perfectly, but after heavy rain, some water got through the seams. It's not completely waterproof like I expected. The adjustable retaining straps and grommets for anti-theft cable are a great feature, but the instructions for the antenna grommet caused damage to my old antenna. Overall, I'm not completely satisfied with this cover.",2,Fits my AMC Rambler American perfectly!,Jerome Morgan,1
AMC,Rambler American,1958-1960,"After purchasing many car covers in the past, the Coverland Premium Car Cover truly lives up to its claims of excellent water protection. It withstood heavy winds without any concerns. I'm impressed and satisfied with this purchase. It's proven to be one of my best car cover investments over the years.",5,Coverland Premium Car Cover is a good investment of protection!,Betty Curran,20
AMC,Rambler American,1958-1960,This truck cover is waterproof and easy to dry off after rain. It's the least expensive cover I've purchased and provides excellent protection. It fits great and the zipper entry for the driver's door is a fantastic feature. I wish I had bought one of these covers years ago.,5,Great truck cover that is almost as good as a garage!,Patricia Gordon,15
AMC,Rambler American,1958-1960,This car cover fits great and really covers the car. It's waterproof and seems to be holding up well. I believe this cover will last longer than others I've purchased. The quality is excellent for the price.,5,Great fit and seems very durable!,Jennifer Crowley,15
AMC,Rambler American,1958-1960,"I've bought many car covers for my car, but this Coverland Premium Car Cover has been the best. It fits well, proved to be waterproof, and was easy to put on and secure. The customer service was terrific when I had an issue, and they promptly sent me a new cover. I will continue to do business with them.",5,Best cover with outstanding customer service!,William Gallimore,10
AMC,Rambler American,1958-1960,"This cover seems more like layers than it is truly waterproof, but for the price, it's a good value. It fits my car very well and the buckle straps keep it in place. I did experience some leakage through the seams, but I plan to try a waterproof spray to help prevent it. Can't comment on durability yet after only one month.",4,Thin but still a good value!,Eduardo Lemaire,5
AMC,Rambler American,1958-1960,"The Coverland car cover for my AMC Rambler American initially fit perfectly, but it didn't hold up well in heavy rain. Water seeped through the seams, which was disappointing. It does have some useful features like reflectors and windproofing straps, but the leakage issue outweighs the positives.",2,"AMC Rambler American cover fits well, but leaks through seams.",Mary Cameron,1
AMC,Marlin,1965-1967,"I was initially impressed with the waterproofness of the Coverland Premium Car Cover for my Buick Roadmaster. However, after only a few months of use, I noticed that the cover started to wear out and tear in some areas. It didn't hold up as well as I had hoped. Despite this, I must admit that it does a good job at keeping my car dry during rainstorms. ",2,"Not as Durable as Expected, but Waterproofness is there",Delores Thompson,1
AMC,Marlin,1965-1967,"The Coverland Premium Car Cover is a fantastic investment for protecting my AMC Marlin. The fit is perfect, and the cover feels durable and well-made. I have experienced heavy rainfall and strong winds, but this cover has stood up to the test. It keeps my car completely dry and secure, even in the harshest weather conditions. I highly recommend this cover for its exceptional fit and durability. ",5,Impressed with the Fit and Durability,Gladys Crosby,20
AMC,Marlin,1965-1967,"I was initially skeptical about the Coverland Premium Car Cover, but it has completely won me over. The material is high quality, and the cover is well-constructed. It has proven to be waterproof and has withstood heavy winds without budging. The added feature of adjustable retaining straps and grommets for anti-theft cables is impressive. I am thoroughly pleased with this purchase and would highly recommend it. ",5,Pleasantly Surprised by the Quality and Performance,Anthony Francis,15
AMC,Marlin,1965-1967,"I bought the Coverland Premium Car Cover as a gift for my car-enthusiast friend, who owns an AMC Marlin. He absolutely loves it! The cover fits his car perfectly and provides excellent protection against the elements. It is easy to install and remove, and the added zipper entry for the driver's door is a convenient feature. My friend couldn't be happier with this cover. ",5,Perfect Gift for a Car Enthusiast,Sharon Ishman,10
AMC,Marlin,1965-1967,"Living in South Florida, I needed a car cover that could withstand the intense heat and humidity. The Coverland Premium Car Cover has exceeded my expectations. It not only provides excellent waterproof protection but also manages to keep my car cool under the scorching sun. I am incredibly satisfied with this cover's performance in the Florida heat. ",5,Impressed with Performance in South Florida Heat,Betty White,5
AMC,Marlin,1965-1967,"The Coverland Premium Car Cover is a great investment to protect my AMC Marlin. It fits perfectly and stays in place, even during strong winds. It keeps my car dry and has excellent durability. I highly recommend this cover for anyone looking for reliable protection for their vehicle. ",5,"Excellent Car Cover, Does the Job Perfectly",Ashley Lively,2
AMC,Marlin,1965-1967,"The Coverland Premium Car Cover is a solid and reliable option for protecting my AMC Marlin. It is well-made, waterproof, and the fit is spot-on. The price is affordable compared to other covers I've seen. I am satisfied with this purchase and would recommend it to others.",5,Good Quality Cover for an Affordable Price,Peter Dunlap,1
AMC,AMX,1978-1980,"I looked at several car covers for my AMC AMX from 1978-1980, and this one looked like the best. It fits perfectly, but I learned that it's not completely waterproof. After a heavy rainstorm, some water got through, probably through a seam. I guess it should be expected, as no car covers are completely waterproof. Other than that, I'm not completely satisfied with this cover.",2,"Good Fit, but Not Completely Waterproof",Thomas Marr,1
AMC,AMX,1978-1980,"I looked at several car covers for my AMC AMX from 1978-1980, and this one looked like the best. It fits perfectly, make sure you use the sizing chart when ordering. However, I learned that it's not completely waterproof. Shortly after putting it on my car, we had a severe thunderstorm, and some water got through, probably through a seam. But I've found that no car covers are completely waterproof, so I guess it should be expected. This particular cover has adjustable retaining straps in the front and back, and comes with an extra strap for the mid-body to secure the cover under the vehicle. It also has grommets for an anti-theft cable or bungee cord to keep the cover firmly in place. It also comes with an antenna grommet, and you can add a large nylon drawstring storage bag. One word of caution, I followed the instructions for installing the cover, which state that it's not necessary to use the antenna grommet if you have a flexible antenna. Well, that didn't work out well because when I removed the cover, which was heavy, my rubber flex antenna was bent and cracked in several places. In retrospect, my car's 40 years old and the rubber was weathered and hardened. But be aware, you might want to remove any detachable antennas before using this cover. A replacement antenna cost me Amazon. Other than that, I'm happy with this cover, it's well-made, easy to install, and stayed on my car in 50 mph winds and heavy rain.",5,Fits My Car Perfectly,Herbert Garcia,20
AMC,AMX,1978-1980,"I bought the Coverland Car Cover, Waterproof All Weather for my AMC AMX from 1978-1980 after reading reviews from other people, and I agree—it fits perfectly. We had rain and snow, and my car stayed dry under this cover. I'm satisfied with my purchase and would recommend it to others.",5,"Good Quality, Good Fit",Jewel Spaulding,20
AMC,AMX,1978-1980,"I've bought many other brands of car covers in the past, all stating that they are waterproof. I can truly attest that this Coverland Premium cover does exactly what it states—excellent water protection. I recently had winds over 50 mph and the fitted car cover adhered perfectly without any concerns whatsoever. In comparison to many other car tarp purchases, this brand has certainly lived up well to its rated waterproof capabilities. I'm truly impressed and satisfied with this car cover purchase. This purchase has proven so far to be one of my best in every aspect of auto covers over the decades.",5,Coverland Premium Car Cover Legitimately a Good Investment of Protection,Mark Bishop,20
AMC,AMX,1978-1980,"This cover is waterproof. It's also easy to dry off after rain. I've purchased many truck covers over the years, and this is the best and least expensive truck cover I have ever purchased. The only bad thing is that I would like to have mirror pockets.",5,Great Truck Cover,Miguel Machado,15
AMC,AMX,1978-1980,"I'm very pleased with this car cover. It's fully waterproof and relatively easy to remove and replace. The cover adapts to the shape of the vehicle over time, so it gets easier to use. I wish I had bought one years ago, as I do not have a home garage.",5,Almost As Good as Garage,Roger Weldon,15
AMC,AMX,1978-1980,It fits great and really covers the car. It's waterproof and seems to be holding up well. I believe that this will last longer than the Budge covers sold in stores by Walmart.,5,"Great Fit, Seems Very Durable",Hester Clinkscales,15
AMC,AMX,1978-1980,"I have bought many covers for my AMC AMX from 1978-1980, and this cover has been the best. It fits well, is waterproof, easy to put on and secure. The only problem is that it only lasted 6 months. However, after 6 months in harsh South Florida sun, the price is excellent. Also, when I contacted the company, I found out that I had an extended warranty. I provided a few pictures showing the material deteriorating, and the company sent me a new cover. The customer service was terrific. They were fast, polite, and professional. I have already received the new cover, and I will continue to do business with them.",5,"Best Cover, Outstanding Customer Service",Rosario Harris,10
AMC,AMX,1978-1980,"This cover seems more like two layers than it is waterproof. It's a good value, though. It fits my car very well, and the buckle straps keep it in place. Recommended.",5,Thin,Morgan Mooney,5
AMC,AMX,1978-1980,"Likes: fits very well, including where the mirrors are. The zipper to get into the car is a handy feature. The reflective straps for windproofing are a nice touch. The cover is colorless, so it's less likely to absorb heat and keeps the car dry. Dislikes: it leaked through the seams. I almost brought it back, but my husband likes the other features, so he's going to try a waterproof spray on the seams to help prevent leakage. Can't comment on durability after only one month.",5,Coverland Premium Car Cover Waterproof All Weather for Buick Roadmaster,Mandy Vanwingerden,2
AMC,AMX,1978-1980,"I've paid lots of money for custom covers that were a pain to put on and keep on my car. It was a breeze to put on, albeit I had to remove the antenna because I didn't want to try my hand at installing the grommet. I trained shortly after installing it and it's really waterproof. The zipper entry for the driver's door is a really great feature.",5,"Great Fit, Keeps My Car Dry",Dorothy Epperson,1
